objectid,filename,youtubeid,vimeoid,identifier,level,classification,worktype,title,creator,date,description,subject,dimensions,materials,source,type,format
demo_001,demo_001.jpg,,,pg_9_12_01bl,item,Visual Arts,painting,"Administration Building, University of Idaho, No. 30",Pacific Photo Co.,1910,"Example locally hosted image item. Photographic postcard of the University of Idaho administration building in Moscow, Idaho.",universities; buildings; campuses; picture postcards,3 cm x 3 cm,oil in canvas,"PG 9, Postcard Collection, Special Collections and Archives, University of Idaho Library",Image;StillImage,image/jpeg
demo_002,demo_002.pdf,,,Postcard_032,collection,Visual Arts,painting,"Spokane County Court House, Spokane, Washington",Spokane Post Card Co.,1912-09-08,"Example locally hosted PDF item. Postcard is of the Spokane County Courthouse in Spokane, Washington. Postmark 9/8/1912, Spokane, WA. Destination San Francisco, CA.",public buildings; county courthouses; trees; picture postcards,3 cm x 3 cm,oil in canvas,"PG 107, Knowles Postcard Collection, Special Collections and Archives, University of Idaho Library",Image;StillImage,application/pdf
demo_003,demo_003.mp3,,,Good_News_08,item,Visual Arts,painting,Good News - Power (Radio Episode Excerpt),"Robinson, Frank B.",1947,Example locally hosted audio item. A short excerpt from a Psychiana radio program episode that begins with assurance that there is a Power that can get people what they desire. Robinson then discusses his early life failures and childhood seeking of some force that could turn his failures into success. He asserts the God-Power can turn our failures into success and bring us material and spiritual abundance.,Frank B. Robinson; Failure; Success; Material Abundance,3 cm x 3 cm,oil in canvas,"Psychiana Digital Collection, Digital Initiatives, University of Idaho Library, https://www.lib.uidaho.edu/digital/psychiana/",Audio,audio/mp3
demo_004,,CVXQ3X6Q8oU,,"MG 23, Item 29",item,Visual Arts,painting,"University of Idaho vs. University of Southern California (Football), 10/30/1925",Vandal Athletics,1925-10-30,"Example YouTube video item. Idaho Football vs. University of Southern California 10/30/1925 at Neale Stadium in Moscow, ID. Score: 7 - 51 (L).",American Football,3 cm x 3 cm,oil in canvas,"Vandal Video Collection, Digital Initiatives, University of Idaho Library, https://www.lib.uidaho.edu/digital/vandalvideo/",Image;MovingImage,video/mp4
demo_005,,,464555587,,collection,Visual Arts,painting,Interview with K. Silem Mohammad,"Becker, Devin",2014-06-16,Example Vimeo video item. Oral history interview with poet K. Silem Mohammad discussing recent changes in writing practices that occurred due to the advent of the computer and the arrival of the digital age.,Poetry,3 cm x 3 cm,oil in canvas,"CTRL+Shift, Center for Digital Inquiry and Learning, University of Idaho Library, https://ctrl-shift.org/",Image;MovingImage,video/mp4
demo_006,https://www.lib.uidaho.edu/collectionbuilder/demo-objects/demo_006.jpg,,,FirePump1,item,Visual Arts,painting,Ford pumper used for slash burning control,"Thompson, J. B.",1932-09-01,Example image item externally hosted on CONTENTdm. Ford pumper used for slash burning control. September 1932. From the photo series depicting the broadcast burn at the mouth of Benton Creek.,forestry,3 cm x 3 cm,oil in canvas,"Experimental Forest and Savenac Nursery Archive, Digital Initiatives, University of Idaho Library, https://www.lib.uidaho.edu/digital/expforest/",Image;StillImage,image/jpeg
demo_007,https://www.doi.org/10.1577/M02-113,,,DOI:10.1577/M02-113,collection,,,Influence of Fishway Placement on Fallback of Adult Salmon at the Bonneville Dam on the Columbia River,"Reischel, T.S.; Bjornn, T.C.",2003,Example metadata-only record with link to external source. Journal article.,fisheries management,,,"North American Journal of Fisheries Management, vol. 23, issue 4, p. 1215-1224. DOI: 10.1577/M02-113",Text,record